{
    "schema_version": 2,
    "blocks": {
    },
    "loops": {
        "loop_super_block": {
            "processor_algorithm": "user-with_dash/block-with_dash/1",
            "processor_parameters": {
                "step": 1
            },
            "processor_inputs": {
                "in": "in"
            },
            "processor_outputs": {
                "out": "out"
            },

            "evaluator_algorithm": "user/db_input_loop_evaluator/1",
            "evaluator_parameters": {
                "threshold": 9
            },
            "evaluator_inputs": {
                "in_loop": "in_loop"
            },
            "evaluator_outputs": {
                "out_loop": "out_loop"
            }
        }
    },
    "analyzers": {
        "analysis": {
            "algorithm": "v1/integers_analysis/1",
            "parameters": {
            },
            "inputs": {
                "input": "input"
            }
        },
        "loop_analysis": {
            "algorithm": "v1/integers_analysis/1",
            "parameters": {
            },
            "inputs": {
                "input": "input"
            }
        }
    },
    "datasets": {
        "integers": {
            "database": "integers_db/1",
            "protocol": "double",
            "set": "double"
        },
        "integers2": {
            "database": "simple/1",
            "protocol": "protocol2",
            "set": "set"
        }
    },
    "globals": {
        "environment": {
            "name": "Python for tests",
            "version": "1.3.0"
        },
        "queue": "queue",
        "user-with_dash/block-with_dash/1": {
            "step": 2
        },
        "user/db_input_loop_evaluator/1" : {
            "threshold": 8
        }
    }
}
